{
  "schema": "blessed/publication-attestation/v1",
  "candidate_sha256": "c0ad731a5652a61324405a2c7e7939423cddfcad2b5919a71d539254d5c70269",
  "surface_id": "public-downloads",
  "channel": "stable",
  "immutable_prefix_url": "https://www.docsort.io/downloads/docsort/releases/v0.4.3/",
  "complete": true,
  "objects": [
    {
      "url": "https://www.docsort.io/downloads/docsort/releases/v0.4.3/DocSort_0.4.3_aarch64.dmg",
      "sha256": "11d0c5a7e3b94f2681c07a5d3e9b04f7128ca6d5e0937b4128fa5c6d0e7b3a91",
      "size": 14830112
    },
    {
      "url": "https://www.docsort.io/downloads/docsort/releases/v0.4.3/DocSort_0.4.3_aarch64.app.tar.gz",
      "sha256": "22e1d6b8f4ca503792d18b6e4fac15082239b7e6f1a48c5239eb6d7e1f8c4b02",
      "size": 13920044
    }
  ]
}
